{
  "version": "hook-production-approval/v1",
  "request_id": "request-1",
  "requested_at": "2026-09-18T07:00:00Z",
  "expires_at": "2027-09-18T07:00:00Z",
  "requester": {
    "id": "release-bot",
    "role": "requester"
  },
  "automated_evidence": {
    "status": "pass",
    "attestation_sha256": "0000000000000000000000000000000000000000000000000000000000000000"
  },
  "bindings": {
    "artifact_sha256": "0000000000000000000000000000000000000000000000000000000000000000",
    "archive_sha256": "0000000000000000000000000000000000000000000000000000000000000000",
    "manifest_sha256": "0000000000000000000000000000000000000000000000000000000000000000",
    "benchmark_sha256": "0000000000000000000000000000000000000000000000000000000000000000",
    "test_sha256": "0000000000000000000000000000000000000000000000000000000000000000",
    "review_sha256": "0000000000000000000000000000000000000000000000000000000000000000"
  },
  "events": []
}
